product_id,seller_id,title,current_price,was_price,location,image_url,product_url,tags,first_seen_date,last_seen_date,closing_date,description,details_json
7977466560572,7402484170812,Airpods 4,₪500,,רמת גן,https://cdn.shopify.com/s/files/1/0590/7860/6908/files/y2_0pa_010635_20250406182812_large.jpg?v=1743953450,https://market.yad2.co.il/collections/אלקטרוניקה_אביזרי-אלקטרוניקה_אוזניות/products/airpods-353,,2025-05-20,2025-05-25,,"למכירה אוזניות Airpods 4 כמו חדשות 
היו בשימוש מספר ימים
נמכרות בגלל חוסר שימוש.","{""מצב המוצר"": ""כמו חדש"", ""תאימות"": ""סלולר"", ""חיבורים"": ""Bluetooth - בלוטות'"", ""יצרן"": ""Apple - אפל"", ""ישוב"": ""רמת גן"", ""קטגוריה"": ""אוזניות""}"
7977471737916,6649123864636,אוזניות,₪500,,קרית אתא,https://cdn.shopify.com/s/files/1/0590/7860/6908/files/y2_0pa_010862_20250406185206_large.jpg?v=1743954885,https://market.yad2.co.il/collections/אלקטרוניקה_אביזרי-אלקטרוניקה_אוזניות/products/אוזניות-660,,2025-05-20,2025-05-25,,"אוזניות סמסונג בידס 
חדשות בקופסא- לא שומשו מעולם
נקנו עבור ריצות ולא מתאימות","{""מצב המוצר"": ""חדש באריזה"", ""תאימות"": ""סלולר"", ""חיבורים"": ""Bluetooth - בלוטות'"", ""יצרן"": ""Samsung - סמסונג"", ""ישוב"": ""קרית אתא"", ""קטגוריה"": ""אוזניות""}"
7977770483772,7358996381756,איירפוד,₪250,,תל אביב יפו,https://cdn.shopify.com/s/files/1/0590/7860/6908/files/y2_0pa_010759_20250407110717_large.jpg?v=1744013503,https://market.yad2.co.il/collections/אלקטרוניקה_אביזרי-אלקטרוניקה_אוזניות/products/איירפוד-1,,2025-05-20,2025-05-25,,איירפוד חדש באריזה. אף פעם לא נפתח.,"{""מצב המוצר"": ""חדש באריזה"", ""תאימות"": ""סלולר"", ""חיבורים"": ""Bluetooth - בלוטות'"", ""יצרן"": ""Apple - אפל"", ""ישוב"": ""תל אביב יפו"", ""קטגוריה"": ""אוזניות""}"
7977839198268,7041350402108,אוזניות בלוטות',₪800,₪990,ירושלים,https://cdn.shopify.com/s/files/1/0590/7860/6908/files/y2_0pa_010912_20250420123816_large.jpg?v=1745141952,https://market.yad2.co.il/collections/אלקטרוניקה_אביזרי-אלקטרוניקה_אוזניות/products/אוזניות-בלוטות-24,,2025-05-20,2025-05-25,,אוזניות מצויינות למי שמכיר את החברה זה מתאים למי שקצת רוצה להשקיע באיכות גבוהה של סאונד מטורף האוזניות כמעט ולא שומשו מגיע עם מגן וכו'אפילו עם האריזה האוזניות באחריות עדיין שאר פרטים בטלפון גמיש במחיר מעט בהזדמנות,"{""מצב המוצר"": ""כמו חדש"", ""יצרן"": ""Bowers and Wilkins"", ""תאימות"": ""סלולר"", ""חיבורים"": ""Bluetooth - בלוטות'"", ""ישוב"": ""ירושלים"", ""קטגוריה"": ""אוזניות""}"
7977971155004,6881459011644,אוזניות אלחוטיות Q30 Anker,₪350,₪380,פרדס חנה כרכור,https://cdn.shopify.com/s/files/1/0590/7860/6908/files/y2_0pa_010250_20250519142602_large.jpg?v=1747653977,https://market.yad2.co.il/collections/אלקטרוניקה_אביזרי-אלקטרוניקה_אוזניות/products/אוזניות-אלחוטיות-q30-anker,,2025-05-20,2025-05-25,,"אוזניות אלחוטיות דגם Q30 משודרג מעולות וקלות (260 גרם בלבד) של חברת Anker.
כוללות ביטול רעשים אקטיבי ANC
סוללה לעד 60 שעות (!), טעינה סופר מהירה של 5דק' = 4 שעות נגינה (!),
חיבור מהיר כולל לשני מכשירים בו זמנית, כולל NFC.
חדשות לגמרי באריזה סגורה","{""מצב המוצר"": ""חדש באריזה"", ""תאימות"": ""כולם"", ""יצרן"": ""Anker"", ""חיבורים"": ""Bluetooth - בלוטות'"", ""ישוב"": ""פרדס חנה כרכור"", ""קטגוריה"": ""אוזניות""}"
7978543546428,6671045230652,Sony WF 1000xm5,₪700,₪750,רמת גן,https://cdn.shopify.com/s/files/1/0590/7860/6908/files/y2_0pa_010152_20250511124417_large.jpg?v=1746956692,https://market.yad2.co.il/collections/אלקטרוניקה_אביזרי-אלקטרוניקה_אוזניות/products/sony-wf-1000xm5-4,,2025-05-20,2025-05-25,,"אוזניות חדשות לחלוטין!!
סגורות בתוך קופסא ואפילו עם הניילון.
נקנו מk.s.p.
יש כמובן קבלה.","{""מצב המוצר"": ""חדש באריזה"", ""ישוב"": ""רמת גן"", ""קטגוריה"": ""אוזניות""}"
7979004854332,6858914562108,Bose quietcomfort ii,₪600,₪700,אשקלון,https://cdn.shopify.com/s/files/1/0590/7860/6908/files/y2_0pa_010716_20250423192054_large.jpg?v=1745425267,https://market.yad2.co.il/collections/אלקטרוניקה_אביזרי-אלקטרוניקה_אוזניות/products/bose-quietcomfort-4,,2025-05-20,2025-05-25,,אוזניות ברמה גבוה מאוד סאונד ברמה גבוה אפליקציה ועוד נמכר כי קניתי חדשים לרציניים בלבד,"{""מצב המוצר"": ""כמו חדש"", ""יצרן"": ""Bose"", ""תאימות"": ""סלולר"", ""חיבורים"": ""Bluetooth - בלוטות'"", ""ישוב"": ""אשקלון"", ""קטגוריה"": ""אוזניות""}"
7979135762492,6988583272508,AirPods Max,"₪1,300","₪1,700",קרית מוצקין,https://cdn.shopify.com/s/files/1/0590/7860/6908/files/y2_0pa_010076_20250504132733_large.jpg?v=1746354477,https://market.yad2.co.il/collections/אלקטרוניקה_אביזרי-אלקטרוניקה_אוזניות/products/airpods-max-64,,2025-05-20,2025-05-25,,הסדרה החדשה צבע מהמם פנינה כזה מצב מושלם שמעתי איתן רק בבית לא יצאתי עם זה החוצה אפילו מומלץ מאוד למי שאוהב מוזיקה מבטל רעשים מושלם איכותי בטירוף מקורי יש קבלה והכל עם קופסא רק חסר מטען ממליץ בחום שומעים טוב מאוד גם באסים חזקים,"{""מצב המוצר"": ""כמו חדש"", ""ישוב"": ""קרית מוצקין"", ""קטגוריה"": ""אוזניות""}"
7979261329468,6856271659068,Galaxy buds 2,₪400,,רחובות,https://cdn.shopify.com/s/files/1/0590/7860/6908/files/y2_0pa_010373_20250408154830_large.jpg?v=1744116723,https://market.yad2.co.il/collections/אלקטרוניקה_אביזרי-אלקטרוניקה_אוזניות/products/galaxy-buds-28,,2025-05-20,2025-05-25,,"אוזניות אלחוטיות של סמסונג מקורי. חדש באריזה.
איסוף מרחובות או ת""א","{""מצב המוצר"": ""חדש באריזה"", ""ישוב"": ""רחובות"", ""קטגוריה"": ""אוזניות""}"
7979300716604,6670333378620,אוזניות JBL,₪250,,ירושלים,https://cdn.shopify.com/s/files/1/0590/7860/6908/files/y2_0pa_010566_20250408162748_large.jpg?v=1744119128,https://market.yad2.co.il/collections/אלקטרוניקה_אביזרי-אלקטרוניקה_אוזניות/products/אוזניות-jbl-62,,2025-05-20,2025-05-25,,"אוזניות עם סינון אקטיבי Tune Flex , חדש באריזה לא נפתח בצבע שחור נקנה ב 300, 32 שעות סוללה","{""מצב המוצר"": ""חדש באריזה"", ""תאימות"": ""סלולר"", ""חיבורים"": ""Bluetooth - בלוטות'"", ""יצרן"": ""JBL"", ""ישוב"": ""ירושלים"", ""קטגוריה"": ""אוזניות""}"
7980656001084,6793644605500,אוזניות סמסונג BUDS פלוס,₪320,₪350,ירושלים,https://cdn.shopify.com/s/files/1/0590/7860/6908/files/y2_0pa_010565_20250504170854_large.jpg?v=1746367759,https://market.yad2.co.il/collections/אלקטרוניקה_אביזרי-אלקטרוניקה_אוזניות/products/אוזניות-סמסונג-buds-פלוס,,2025-05-20,2025-05-25,,"האוזניות חדשות לא היו בשימווש  

לא בשבת","{""מצב המוצר"": ""חדש באריזה"", ""תאימות"": ""סלולר"", ""חיבורים"": ""Bluetooth - בלוטות'"", ""יצרן"": ""Samsung - סמסונג"", ""ישוב"": ""ירושלים"", ""קטגוריה"": ""אוזניות""}"
7980695552060,6984301936700,אוזניות הולכת עצם לשחייה ספורט,₪800,,מודיעין עילית,https://cdn.shopify.com/s/files/1/0590/7860/6908/files/y2_0pa_010837_20250409152441_large.jpg?v=1744201520,https://market.yad2.co.il/collections/אלקטרוניקה_אביזרי-אלקטרוניקה_אוזניות/products/אוזניות-הולכת-עצם-לשחייה-ספורט,,2025-05-20,2025-05-25,,"אוזניות הולכת עצם לשחייה ולספורט הם במצב חדש ונמכרות עקב חוסר שימוש מיועדות לשחייה צלילה ולספורט אפשר להוריד שירים לאוזניות או לשמוע דרך הטלפון
עם אפליקציה לשליטה באוזניות","{""מצב המוצר"": ""כמו חדש"", ""יצרן"": ""SHOKZ"", ""תאימות"": ""סלולר"", ""חיבורים"": ""Bluetooth - בלוטות'"", ""ישוב"": ""מודיעין עילית"", ""קטגוריה"": ""אוזניות""}"
7980698435644,6935797596220,אוזניות ראש,₪500,₪600,אשדוד,https://cdn.shopify.com/s/files/1/0590/7860/6908/files/y2_0pa_010138_20250504160925_large.jpg?v=1746364217,https://market.yad2.co.il/collections/אלקטרוניקה_אביזרי-אלקטרוניקה_אוזניות/products/אוזניות-ראש,,2025-05-20,2025-05-25,,"אוזניות במצב מצוין טובות מאוד איכות שמע מעולה יש להם גם השתקת רעשים ועצירת מוזיקה וחיבור לאוזניות קוויות איכות האוזניות מעולה מרגישות נוחות באוזניים גם אפשר להקטין ולהגדיל את הרצועה של האוזניות להתאים לראש זה מחיר טוב זה אוזניות איכותיות לא סתם,מחיר אחרון עם עולות הרבה יותר","{""מצב המוצר"": ""כמו חדש"", ""תאימות"": ""אוזניות"", ""יצרן"": ""Plantronice"", ""חיבורים"": ""Bluetooth - בלוטות'"", ""ישוב"": ""אשדוד"", ""קטגוריה"": ""אוזניות""}"
7980699582524,6647324409916,אוזניות Logitech G935,₪350,,חדרה,https://cdn.shopify.com/s/files/1/0590/7860/6908/files/y2_0pa_010699_20250409153043_large.jpg?v=1744202034,https://market.yad2.co.il/collections/אלקטרוניקה_אביזרי-אלקטרוניקה_אוזניות/products/אוזניות-logitech-g935,,2025-05-20,2025-05-25,,"למכירה אוזניות גיימינג אלחוטיות של חברת Logitech
דגם G935.

האוזניות שמורות מאוד, במצב מעולה.
מגיעות עם כבל הטענה והמעמד לאוזניות.
לצערי אני לא מוצא את הכבל החוטי עם המיקרופון.

איסוף מחדרה.","{""מצב המוצר"": ""משומש"", ""ישוב"": ""חדרה"", ""קטגוריה"": ""אוזניות""}"
7981342130236,7413600878652,JABRA Evolve2 75 Bluetooth,₪799,₪899,הרצליה,https://cdn.shopify.com/s/files/1/0590/7860/6908/files/y2_0pa_010660_20250506104122_large.jpg?v=1746517400,https://market.yad2.co.il/collections/אלקטרוניקה_אביזרי-אלקטרוניקה_אוזניות/products/jabra-evolve2-75-bluetooth,,2025-05-20,2025-05-25,,"חדש באריזה, לא שומש, 30 אחוז מתחת למחיר שוק. דגם Evolve2 גרסת 75 - בעל סינון רעשים אקטיבי (ANC) - 8 מיקרופונים לאיכות שמע מעולה - 36 שעות סוללה - חיבור בלוטות' שעובד עד 30 מטר - תאימות לאפליקציה עם שליטה באקולייזר - נוחות מקסימלית עם כריות מרופדות לבית/משרד/נסיעות. עדיפות בווצאפ.","{""מצב המוצר"": ""חדש באריזה"", ""תאימות"": ""סלולר"", ""חיבורים"": ""Bluetooth - בלוטות'"", ""יצרן"": ""Jabra - ג'ברה"", ""ישוב"": ""הרצליה"", ""קטגוריה"": ""אוזניות""}"
7981400621116,6668590940220,אוזניות JBL,₪200,,מודיעין מכבים רעות,https://cdn.shopify.com/s/files/1/0590/7860/6908/files/y2_0pa_010817_20250410141021_large.jpg?v=1744283631,https://market.yad2.co.il/collections/אלקטרוניקה_אביזרי-אלקטרוניקה_אוזניות/products/אוזניות-jbl-63,,2025-05-20,2025-05-25,,"אוזניות JBL למכירה נמכר עקב בעיות בחיבור ובסוללה, כן מתחברות לטלפון כן עובדות  עם סאונד טוב אך יכול להיות מצב שבו האוזניות מתנתקות ואורך החיים של הסוללה ממש קצרה. גמיש במחיר!","{""מצב המוצר"": ""נדרש תיקון"", ""תאימות"": ""סלולר"", ""חיבורים"": ""Bluetooth - בלוטות'"", ""יצרן"": ""JBL"", ""ישוב"": ""מודיעין מכבים רעות"", ""קטגוריה"": ""אוזניות""}"
7981406519356,7084150292540,Arctis Nova 3,₪280,,מבשרת ציון,https://cdn.shopify.com/s/files/1/0590/7860/6908/files/y2_0pa_010167_20250410143435_large.jpg?v=1744284901,https://market.yad2.co.il/collections/אלקטרוניקה_אביזרי-אלקטרוניקה_אוזניות/products/arctis-nova-3,,2025-05-20,2025-05-25,,"אוזניות גיימינג סטיל סירייס במצב מעולה כמו חדש 
איכות סאונד מטורפת חווית סאונד מטורפת שומעים כל נקודה במשחקי מחשב ובסרטונים מעולה לכל דבר יש מיקרופון מובנה 
שומעים מצויין אוזניות מצוינות לכל דבר .","{""מצב המוצר"": ""משומש"", ""יצרן"": ""Steelseries"", ""תאימות"": ""גיימינג"", ""חיבורים"": ""חוטיות"", ""ישוב"": ""מבשרת ציון"", ""קטגוריה"": ""אוזניות""}"
7981741277244,7239369326652,אוזניות חוטיות Arctis nova 3,₪280,,מודיעין מכבים רעות,https://cdn.shopify.com/s/files/1/0590/7860/6908/files/y2_0pa_010029_20250410203050_large.jpg?v=1744306759,https://market.yad2.co.il/collections/אלקטרוניקה_אביזרי-אלקטרוניקה_אוזניות/products/אוזניות-חוטיות-arctis-nova-3,,2025-05-20,2025-05-25,,למכירה אוזניות של חברה steelseries קבלתי מתנה לפני חצי שנה לא השתמשתי הרבה,"{""מצב המוצר"": ""כמו חדש"", ""ישוב"": ""מודיעין מכבים רעות"", ""קטגוריה"": ""אוזניות""}"
7982564147260,6653719216188,Airpads,₪200,,בני ברק,https://cdn.shopify.com/s/files/1/0590/7860/6908/files/y2_0pa_010489_20250411113256_large.jpg?v=1744360437,https://market.yad2.co.il/collections/אלקטרוניקה_אביזרי-אלקטרוניקה_אוזניות/products/airpads,,2025-05-20,2025-05-25,,"אוזניות של אפל מקוריות מוכר כי נעלם אחד 
 הם פשוט חזקות איכותיות","{""מצב המוצר"": ""כמו חדש"", ""תאימות"": ""הכל"", ""חיבורים"": ""Bluetooth - בלוטות'"", ""יצרן"": ""Apple - אפל"", ""ישוב"": ""בני ברק"", ""קטגוריה"": ""אוזניות""}"
7982689288252,6671729393724,apple airpods 4,₪490,,ירושלים,https://cdn.shopify.com/s/files/1/0590/7860/6908/files/y2_0pa_010989_20250418112301_large.jpg?v=1744964602,https://market.yad2.co.il/collections/אלקטרוניקה_אביזרי-אלקטרוניקה_אוזניות/products/apple-airpods-47,,2025-05-20,2025-05-25,,"אוזניות apple airpods 4. אוזניות איירפודס בלוטוס של חברת אפל דור 4 ללא סינון רעשים. נקנה ב IVORY במחיר 529 ש""ח. אחריות 1 שנה - נקנה בתאריך 11/04/2025. נמכר בגלל חוסר תאימות לאוזן (אוזן קטנה במיוחד) ואין אפשרות להחזיר לחנות אריזה שנפתחה. נמכר במחיר מציאה ! האוזניות חדשות לגמרי ללא כל שימוש!","{""מצב המוצר"": ""חדש באריזה"", ""תאימות"": ""אוזניות"", ""חיבורים"": ""Bluetooth - בלוטות'"", ""יצרן"": ""Apple - אפל"", ""ישוב"": ""ירושלים"", ""קטגוריה"": ""אוזניות""}"
7983045214268,7415822385212,steelseries nova 3,₪300,₪350,באר שבע,https://cdn.shopify.com/s/files/1/0590/7860/6908/files/y2_0pa_010855_20250419204129_large.jpg?v=1745084529,https://market.yad2.co.il/collections/אלקטרוניקה_אביזרי-אלקטרוניקה_אוזניות/products/steelseries-nova-3,,2025-05-20,2025-05-25,,"אוזניות גיימינג איכותיות מבית steelseries תומכת Sonar. שימוש 1, לא התחברתי וחזרתי ל steelseries arctis pro. נקנו ב430 עם משלוח. המחיר סופי","{""מצב המוצר"": ""כמו חדש"", ""יצרן"": ""steelseries"", ""תאימות"": ""גיימינג"", ""חיבורים"": ""חוטיות"", ""ישוב"": ""באר שבע"", ""קטגוריה"": ""אוזניות""}"
7983500361788,7234852323388,Honor Pad 9,₪600,"₪1,000",רמת גן,https://cdn.shopify.com/s/files/1/0590/7860/6908/files/y2_0pa_010748_20250505131418_large.jpg?v=1746440080,https://market.yad2.co.il/collections/אלקטרוניקה_אביזרי-אלקטרוניקה_אוזניות/products/honor-pad-9,,2025-05-20,2025-05-25,,"Honor Pad 9 in excellent condition. 12.1"" 2.5K display, 120Hz refresh rate, Snapdragon 6 Gen 1, 8GB RAM, 256GB storage, 8300mAh battery, 13MP rear and 8MP front cameras. Runs on Android 13 with MagicOS 7.2. Comes with box, charger. Message me for details!","{""מצב המוצר"": ""משומש"", ""ישוב"": ""רמת גן"", ""קטגוריה"": ""אוזניות""}"
7983624388668,6646731243580,Apple AirPods Pro,₪500,,לוד,https://cdn.shopify.com/s/files/1/0590/7860/6908/files/y2_0pa_010806_20250502152848_large.jpg?v=1746188940,https://market.yad2.co.il/collections/אלקטרוניקה_אביזרי-אלקטרוניקה_אוזניות/products/apple-airpods-pro-39,,2025-05-20,2025-05-25,,"אוזניות Apple AirPods Pro (דור ראשון) במצב שמור מאוד, עובדות מצוין וללא תקלות.
אוזניות איכותיות עם ביטול רעשים אקטיבי (ANC), מצב שקיפות (Transparency Mode), התאמה אישית לאוזן ונוחות לאורך זמן.

הקייס נטען ומחזיק סוללה טוב מאוד. 
האוזניות עצמן שומרות על זמן סוללה כמו שצריך.
האוזניות נוקו וחוטאו לפני המכירה, ומגיעות מוכנות לשימוש מיידי. במצב שמור מאוד לאספנים.
מגיע עם כייס עמיד בפני נפילות.","{""מצב המוצר"": ""כמו חדש"", ""תאימות"": ""סלולר"", ""חיבורים"": ""Bluetooth - בלוטות'"", ""יצרן"": ""Apple - אפל"", ""ישוב"": ""לוד"", ""קטגוריה"": ""אוזניות""}"
7983640281148,6826940399676,אוזניות AirPods 4,₪500,,מודיעין מכבים רעות,https://cdn.shopify.com/s/files/1/0590/7860/6908/files/y2_0pa_010933_20250412195433_large.jpg?v=1744477027,https://market.yad2.co.il/collections/אלקטרוניקה_אביזרי-אלקטרוניקה_אוזניות/products/אוזניות-airpods-30,,2025-05-20,2025-05-25,,"נפתחו לצורך בדיקה נמכר עקב אי שימוש אוזניות מקוריות איכותיות מאוד,גמיש טיפה.","{""מצב המוצר"": ""כמו חדש"", ""תאימות"": ""סלולר"", ""חיבורים"": ""Bluetooth - בלוטות'"", ""יצרן"": ""Apple - אפל"", ""ישוב"": ""מודיעין מכבים רעות"", ""קטגוריה"": ""אוזניות""}"
7983866773564,6820118560828,אוזניות SONY,₪650,₪700,עפולה,https://cdn.shopify.com/s/files/1/0590/7860/6908/files/y2_0pa_010458_20250512165929_large.jpg?v=1747058409,https://market.yad2.co.il/collections/אלקטרוניקה_אביזרי-אלקטרוניקה_אוזניות/products/אוזניות-sony-9,,2025-05-20,2025-05-25,,"המוצר כמעט ולא היה בשימוש. יש שיפשוף קטן בצד רואים בתמונה.
דגם WH-1000XM5B","{""מצב המוצר"": ""כמו חדש"", ""תאימות"": ""סלולר"", ""חיבורים"": ""Bluetooth - בלוטות'"", ""יצרן"": ""Sony - סוני"", ""ישוב"": ""עפולה"", ""קטגוריה"": ""אוזניות""}"
7984066691132,7420035530812,אוזניות AirPods 4,₪550,,אליכין,https://cdn.shopify.com/s/files/1/0590/7860/6908/files/y2_0pa_010630_20250413212023_large.jpg?v=1744569182,https://market.yad2.co.il/collections/אלקטרוניקה_אביזרי-אלקטרוניקה_אוזניות/products/אוזניות-airpods-31,,2025-05-20,2025-05-25,,"AirPods חדשות לגמרי לא נעשה שימוש אפילו פעם אחד נאלץ למכור עקב טעות בדגם שרציתי 
יש אחריות חברה ל12 חודשים 
גמיש במחיר 
דורש 550","{""מצב המוצר"": ""חדש באריזה"", ""ישוב"": ""אליכין"", ""קטגוריה"": ""אוזניות""}"
7984070393916,6710979952700,AirPods Pro 2 USB-C,₪750,,ירושלים,https://cdn.shopify.com/s/files/1/0590/7860/6908/files/y2_0pa_010668_20250413214043_large.jpg?v=1744570260,https://market.yad2.co.il/collections/אלקטרוניקה_אביזרי-אלקטרוניקה_אוזניות/products/airpods-pro-2-usb-c-5,,2025-05-20,2025-05-25,,"אוזניות Apple AirPods Pro 2 עם חיבור USB-C. מקוריות כמובן, במצב מצוין! כולל כבל ומגן. אחריות בתוקף עד 11/7/2025 מהיבואן הרשמי. נמכרות עקב שדרוג. מחיר נוח וגמיש לרציניים. לאיסוף מרמת שלמה, ירושלים. פנו בפרטי!","{""מצב המוצר"": ""כמו חדש"", ""תאימות"": ""סלולר"", ""חיבורים"": ""Bluetooth - בלוטות'"", ""יצרן"": ""Apple - אפל"", ""ישוב"": ""ירושלים"", ""קטגוריה"": ""אוזניות""}"
7984075407420,6670105968700,אוזניות,₪300,,נתניה,https://cdn.shopify.com/s/files/1/0590/7860/6908/files/y2_0pa_010547_20250413221234_large.jpg?v=1744571641,https://market.yad2.co.il/collections/אלקטרוניקה_אביזרי-אלקטרוניקה_אוזניות/products/אוזניות-673,,2025-05-20,2025-05-25,,"אוזניות חדשות נקנו ב 950 שקל.
עברתי לאייפון בגלל זה מוכר 
לא בשבת !!!!","{""מצב המוצר"": ""חדש באריזה"", ""תאימות"": ""סלולר"", ""חיבורים"": ""Bluetooth - בלוטות'"", ""יצרן"": ""Samsung - סמסונג"", ""ישוב"": ""נתניה"", ""קטגוריה"": ""אוזניות""}"
7984289775676,7239262011452,אוזניות ביטס סטודיו פרו,₪650,,דימונה,https://cdn.shopify.com/s/files/1/0590/7860/6908/files/y2_0pa_010357_20250414060438_large.jpg?v=1744599963,https://market.yad2.co.il/collections/אלקטרוניקה_אביזרי-אלקטרוניקה_אוזניות/products/אוזניות-ביטס-סטודיו-פרו,,2025-05-20,2025-05-25,,"נקנו במתנה . 
שומש פעמיים בלבד ! 
חדשות ! עדין באריזה המקורית . 
מגיע עם קייס מקורי של ביטס .","{""מצב המוצר"": ""כמו חדש"", ""תאימות"": ""סלולר"", ""חיבורים"": ""Bluetooth - בלוטות'"", ""יצרן"": ""Beats - ביטס"", ""ישוב"": ""דימונה"", ""קטגוריה"": ""אוזניות""}"
7984374808636,7154431393852,אוזניות RHA חדשות באריזה,₪300,₪480,פתח תקווה,https://cdn.shopify.com/s/files/1/0590/7860/6908/files/y2_0pa_010074_20250425113217_large.jpg?v=1745569958,https://market.yad2.co.il/collections/אלקטרוניקה_אביזרי-אלקטרוניקה_אוזניות/products/אוזניות-rha-חדשות-באריזה,,2025-05-20,2025-05-25,,אוזניות RHA חדשות באריזה לא נעשה שימוש כלל.,"{""מצב המוצר"": ""חדש באריזה"", ""יצרן"": ""RHA"", ""תאימות"": ""סלולר"", ""חיבורים"": ""Bluetooth - בלוטות'"", ""ישוב"": ""פתח תקווה"", ""קטגוריה"": ""אוזניות""}"
7984402858044,6691884105788,jbl tour one m2,₪400,₪450,תל אביב יפו,https://cdn.shopify.com/s/files/1/0590/7860/6908/files/y2_0pa_010403_20250518155813_large.jpg?v=1747573114,https://market.yad2.co.il/collections/אלקטרוניקה_אביזרי-אלקטרוניקה_אוזניות/products/jbl-tour-one-m2,,2025-05-20,2025-05-25,,מדובר באוזניות jbl tour one m2 שנקנו לפני פחות מחודשיים. מוכר עקב חוסר בשימוש(השתמשתי כמה פעמים בודדות). קניתי במטרה להשתמש בעבודה ונאמר לי שאסור להשתמש בהם כי לא אשמע את הסביבה. הם במצב מצוין. ממש כמו חדשות. מי שמעוניין שיפנה בוואטספ. מקבל מזומן רק. תודה מראש.,"{""מצב המוצר"": ""כמו חדש"", ""תאימות"": ""סלולר"", ""חיבורים"": ""Bluetooth - בלוטות'"", ""יצרן"": ""JBL"", ""ישוב"": ""תל אביב יפו"", ""קטגוריה"": ""אוזניות""}"
