product_id,seller_id,title,current_price,was_price,location,image_url,product_url,tags,first_seen_date,last_seen_date,closing_date,description,details_json
7897884393532,7126772088892,אוזניות AKG 612 PRO,₪550,₪580,קרית אתא,https://cdn.shopify.com/s/files/1/0590/7860/6908/files/y2_0pa_010825_20250107193905_large.jpg?v=1736271557,https://market.yad2.co.il/collections/אלקטרוניקה_אביזרי-אלקטרוניקה_אוזניות/products/אוזניות-akg-612-pro,,2025-05-20,2025-05-25,,אוזניות מקצועיות לאולפן מיקסים מאסטרניג ולהאזנה כללית,"{""מצב המוצר"": ""כמו חדש"", ""יצרן"": ""AKG"", ""תאימות"": ""תקלוט ואולפן"", ""חיבורים"": ""חוטיות"", ""ישוב"": ""קרית אתא"", ""קטגוריה"": ""אוזניות""}"
7899058438204,7251036766268,אוזניות אלחוטיות Anker Q45,₪300,₪400,נצרת עילית / נוף הגליל,https://cdn.shopify.com/s/files/1/0590/7860/6908/files/y2_0pa_010350_20250502081728_large.jpg?v=1746163059,https://market.yad2.co.il/collections/אלקטרוניקה_אביזרי-אלקטרוניקה_אוזניות/products/אוזניות-אלחוטיות-anker-q45,,2025-05-20,2025-05-25,,"חדש, עם אריזות ואביזרים, כמעט ולא נעשה בהם שימוש. אוזניות מצוינות, ביטול רעשים וסאונד מעולים, אבל לא התאימו בגודל (קניתי לאשתי, אבל לפי גודל אוזניות של edifier התאימו לה יותר) מחיר בחנויות 550-650₪.","{""מצב המוצר"": ""כמו חדש"", ""תאימות"": ""סלולר"", ""ישוב"": ""נצרת עילית / נוף הגליל"", ""קטגוריה"": ""אוזניות""}"
7900193816636,6680709300284,אוזניות סנהייזר HD650,₪990,"₪1,090",גדרה,https://cdn.shopify.com/s/files/1/0590/7860/6908/files/y2_0pa_010044_20250109045606_large.jpg?v=1736391395,https://market.yad2.co.il/collections/אלקטרוניקה_אביזרי-אלקטרוניקה_אוזניות/products/אוזניות-סנהייזר-hd650,,2025-05-20,2025-05-25,,"למבינים
הכי זול בזאפ 1615","{""מצב המוצר"": ""כמו חדש"", ""יצרן"": ""סנהייזר"", ""תאימות"": ""תקלוט ואולפן"", ""חיבורים"": ""חוטיות"", ""ישוב"": ""גדרה"", ""קטגוריה"": ""אוזניות""}"
7903593824316,6936524161084,AirPods,₪250,,באר שבע,https://cdn.shopify.com/s/files/1/0590/7860/6908/files/y2_0pa_010003_20250111161435_large.jpg?v=1736604885,https://market.yad2.co.il/collections/אלקטרוניקה_אביזרי-אלקטרוניקה_אוזניות/products/airpods-304,,2025-05-20,2025-05-25,,הקודם זוכה,"{""מצב המוצר"": ""חדש באריזה"", ""תאימות"": ""סלולר"", ""חיבורים"": ""Bluetooth - בלוטות'"", ""יצרן"": ""Apple - אפל"", ""ישוב"": ""באר שבע"", ""קטגוריה"": ""אוזניות""}"
7903712182332,6909694935100,אוזניות סמסונג BUDS PRO 2,₪350,,בת ים,https://cdn.shopify.com/s/files/1/0590/7860/6908/files/y2_0pa_010427_20250111205452_large.jpg?v=1736621758,https://market.yad2.co.il/collections/אלקטרוניקה_אביזרי-אלקטרוניקה_אוזניות/products/אוזניות-סמסונג-buds-pro-3,,2025-05-20,2025-05-25,,"אוזניות חדשות לגמרי, התקבלו מתנה במסגרת רכישת טלפון, לא היו בשימוש כלל, מחיר מציאה לרציניים בלבד, לא גמיש במחיר, איסוף מבת-ים.","{""מצב המוצר"": ""כמו חדש"", ""תאימות"": ""סלולר"", ""חיבורים"": ""Bluetooth - בלוטות'"", ""יצרן"": ""Samsung - סמסונג"", ""ישוב"": ""בת ים"", ""קטגוריה"": ""אוזניות""}"
7904242237500,7165717413948,אוזניות,₪200,,חדרה,https://cdn.shopify.com/s/files/1/0590/7860/6908/files/y2_0pa_010972_20250112173346_large.jpg?v=1736696041,https://market.yad2.co.il/collections/אלקטרוניקה_אביזרי-אלקטרוניקה_אוזניות/products/אוזניות-524,,2025-05-20,2025-05-25,,אוזניות טובות ואיכותיות,"{""מצב המוצר"": ""כמו חדש"", ""יצרן"": ""Steelers"", ""תאימות"": ""גיימינג"", ""חיבורים"": ""חוטיות"", ""ישוב"": ""חדרה"", ""קטגוריה"": ""אוזניות""}"
7904351584316,6667871289404,אוזניות איירפודס,₪300,₪350,באר שבע,https://cdn.shopify.com/s/files/1/0590/7860/6908/files/y2_0pa_010376_20250516183616_large.jpg?v=1747409788,https://market.yad2.co.il/collections/אלקטרוניקה_אביזרי-אלקטרוניקה_אוזניות/products/אוזניות-איירפודס-83,,2025-05-20,2025-05-25,,"אוזניות איירפודס 3 מקוריות של אפל, במצב מעולה.","{""מצב המוצר"": ""כמו חדש"", ""תאימות"": ""סלולר"", ""חיבורים"": ""Bluetooth - בלוטות'"", ""יצרן"": ""Apple - אפל"", ""ישוב"": ""באר שבע"", ""קטגוריה"": ""אוזניות""}"
7904395100220,6671929147452,אוזניות אלחוטיות JBL חדשות,₪220,,פתח תקווה,https://cdn.shopify.com/s/files/1/0590/7860/6908/files/y2_0pa_010909_20250423193035_large.jpg?v=1745425947,https://market.yad2.co.il/collections/אלקטרוניקה_אביזרי-אלקטרוניקה_אוזניות/products/אוזניות-אלחוטיות-jbl-חדשות-1,,2025-05-20,2025-05-25,,"אוזניות Bluetooth של JBL במצב חדש לגמרי! סאונד עוצמתי ועמוק, וחיי סוללה ארוכים במיוחד. מגיע עם כבל הטעינה המקורי. הדרייברים מתקפלים למימדים קומפקטיים במיוחד. נרכשו ב 350₪ ולא היו בשימוש בכלל. כל הקודם זוכה!","{""מצב המוצר"": ""כמו חדש"", ""תאימות"": ""סלולר"", ""חיבורים"": ""Bluetooth - בלוטות'"", ""יצרן"": ""JBL"", ""ישוב"": ""פתח תקווה"", ""קטגוריה"": ""אוזניות""}"
7904514441276,6666255761468,אוזניות בלוטות budz 3 Samsung,₪200,,חיפה,https://cdn.shopify.com/s/files/1/0590/7860/6908/files/y2_0pa_010088_20250113101340_large.jpg?v=1736756367,https://market.yad2.co.il/collections/אלקטרוניקה_אביזרי-אלקטרוניקה_אוזניות/products/אוזניות-בלוטות-budz-3-samsung,,2025-05-20,2025-05-25,,"אוזניות Samsung Galaxy 
 במצב חדש Buds3 SM-R530 Bluetooth","{""מצב המוצר"": ""כמו חדש"", ""ישוב"": ""חיפה"", ""קטגוריה"": ""אוזניות""}"
7904632406076,7261544153148,OnePlus Nord Buds 3,₪200,,ירושלים,https://cdn.shopify.com/s/files/1/0590/7860/6908/files/y2_0pa_010469_20250113151436_large.jpg?v=1736774175,https://market.yad2.co.il/collections/אלקטרוניקה_אביזרי-אלקטרוניקה_אוזניות/products/oneplus-nord-buds-3,,2025-05-20,2025-05-25,,"OnePlus Nord Buds 3
קיבלתי אותם במסגרת רכישת טלפון חדש ואני לא אשתמש בהם.
האוזניות בצבע כחול.
לפרטים נוספים:","{""מצב המוצר"": ""חדש באריזה"", ""יצרן"": ""OnePlus"", ""תאימות"": ""סלולר"", ""חיבורים"": ""Bluetooth - בלוטות'"", ""ישוב"": ""ירושלים"", ""קטגוריה"": ""אוזניות""}"
7906179383356,6888945090620,אוזניות DEWALT,₪400,,בית שמש,https://cdn.shopify.com/s/files/1/0590/7860/6908/files/y2_0pa_010488_20250114223732_large.jpg?v=1736887112,https://market.yad2.co.il/collections/אלקטרוניקה_אביזרי-אלקטרוניקה_אוזניות/products/אוזניות-dewalt,,2025-05-20,2025-05-25,,אוזניות דיוולט הדגם עם רמקול חיצוני. בשימוש כחודש. מצב חדש.,"{""מצב המוצר"": ""כמו חדש"", ""יצרן"": ""DEWALT"", ""תאימות"": ""סלולר"", ""חיבורים"": ""Bluetooth - בלוטות'"", ""ישוב"": ""בית שמש"", ""קטגוריה"": ""אוזניות""}"
7906709733436,6857479520316,oneplus Nord Buds 3,₪200,,קרית אונו,https://cdn.shopify.com/s/files/1/0590/7860/6908/files/y2_0pa_010540_20250115121243_large.jpg?v=1736936042,https://market.yad2.co.il/collections/אלקטרוניקה_אביזרי-אלקטרוניקה_אוזניות/products/oneplus-nord-buds-4,,2025-05-20,2025-05-25,,"אוזניות ואן פלוס נורד בדס 3, קיבלתי אותם עם החבילה של הטלפון שהזמנתי, מוכר עקב חוסר שימוש. מגיעות עם קייס טעינה וכבל טעינה, הוראות הפעלה, הכל נמצא בקופסא המקורית מהיבואן!","{""מצב המוצר"": ""חדש באריזה"", ""יצרן"": ""oneplus"", ""תאימות"": ""סלולר"", ""חיבורים"": ""Bluetooth - בלוטות'"", ""ישוב"": ""קרית אונו"", ""קטגוריה"": ""אוזניות""}"
7906861285436,6907045969980,אוזניות Sennheiser Momentum 4,₪699,₪799,כפר סבא,https://cdn.shopify.com/s/files/1/0590/7860/6908/files/y2_0pa_010940_20250115150210_large.jpg?v=1736946260,https://market.yad2.co.il/collections/אלקטרוניקה_אביזרי-אלקטרוניקה_אוזניות/products/אוזניות-sennheiser-momentum-5,,2025-05-20,2025-05-25,,"אוזניות סנהייזר מומנטום 4 במצב כמו חדש בקושי היו בשימוש. נמכרות עקב חוסר שימוש. מגיעות עם כבל טעינה מקורי וכל הסיליקונים לאוזניים המקוריים. באחריות עד 08/03/26

מחיר אחרון.","{""מצב המוצר"": ""כמו חדש"", ""תאימות"": ""סלולר"", ""ישוב"": ""כפר סבא"", ""קטגוריה"": ""אוזניות""}"
7906902736956,7226005913660,אוזניות בלוטות טאוטרוניקס,₪200,₪250,פתח תקווה,https://cdn.shopify.com/s/files/1/0590/7860/6908/files/y2_0pa_010086_20250115175228_large.jpg?v=1743163965,https://market.yad2.co.il/collections/אלקטרוניקה_אביזרי-אלקטרוניקה_אוזניות/products/אוזניות-בלוטות-טאוטרוניקס,,2025-05-20,2025-05-25,,אוזניות חדשות של חברת טאוטרוניקס באריזה לא נפתחו סאונד מדהים עם בידוד רעשים דגם TT-BH085 מוכר ב-200 בלבד חדש עולה 400,"{""מצב המוצר"": ""חדש באריזה"", ""יצרן"": ""Taotronics"", ""תאימות"": ""תקלוט ואולפן"", ""חיבורים"": ""Bluetooth - בלוטות'"", ""ישוב"": ""פתח תקווה"", ""קטגוריה"": ""אוזניות""}"
7909400215612,7251036766268,Anker Soundcore Liberty 4 Pro,₪300,₪350,נצרת עילית / נוף הגליל,https://cdn.shopify.com/s/files/1/0590/7860/6908/files/y2_0pa_010566_20250502081701_large.jpg?v=1746163037,https://market.yad2.co.il/collections/אלקטרוניקה_אביזרי-אלקטרוניקה_אוזניות/products/anker-soundcore-liberty-4-pro-1,,2025-05-20,2025-05-25,,"חדש, עם אריזות ואביזרים, כמעט ולא נעשה בהם שימוש. מחיר בחנויות 650₪.","{""מצב המוצר"": ""כמו חדש"", ""יצרן"": ""Anker"", ""תאימות"": ""סלולר"", ""חיבורים"": ""Bluetooth - בלוטות'"", ""ישוב"": ""נצרת עילית / נוף הגליל"", ""קטגוריה"": ""אוזניות""}"
7910486933564,7268313890876,אוזניות Gigabyte Aorus H5,₪200,₪220,קרית גת,https://cdn.shopify.com/s/files/1/0590/7860/6908/files/y2_0pa_010528_20250122180333_large.jpg?v=1737561824,https://market.yad2.co.il/collections/אלקטרוניקה_אביזרי-אלקטרוניקה_אוזניות/products/אוזניות-gigabyte-aorus-h5,,2025-05-20,2025-05-25,,"אוזניות גיימינג מתקדמות עם דרייבר 50 מ""מ ותאורת RGB 2.0 בעלות מעל 16.7 מיליון צבעים, נוחות לשימוש ומתאימות לשעות ארוכות של משחקים. עובדת על טלפון נייד, קונסולה, מחשב נייד ומחשב עם חיבור אודיו מובנה. (חיבור רמקול 3.5 מ""מ וחיבור מיקרופון עובדים לקלטת אודיו, חיבור USB משמש להפעלת תאורת ה- RGB)

איסוף מקרית גת או באר שבע","{""מצב המוצר"": ""חדש באריזה"", ""יצרן"": ""Gigabyte Aorus"", ""תאימות"": ""גיימינג"", ""חיבורים"": ""חוטיות"", ""ישוב"": ""קרית גת"", ""קטגוריה"": ""אוזניות""}"
7910495715388,6670396293180,אוזניות אירפורדס 3,₪300,,אור יהודה,https://cdn.shopify.com/s/files/1/0590/7860/6908/files/y2_0pa_010499_20250122183159_large.jpg?v=1737563571,https://market.yad2.co.il/collections/אלקטרוניקה_אביזרי-אלקטרוניקה_אוזניות/products/אוזניות-אירפורדס-3,,2025-05-20,2025-05-25,,אוזניות אירפורדס 3 מקוריות צד שמאל לא עובד לא נפל לא היה במים לא כלום לא יודע למה לא עובד נמכר עקב מעבר לאירפורדס 4 ובלי כוח להתעסק עם זה,"{""מצב המוצר"": ""נדרש תיקון"", ""תאימות"": ""אוזניות"", ""חיבורים"": ""Bluetooth - בלוטות'"", ""יצרן"": ""Apple - אפל"", ""ישוב"": ""אור יהודה"", ""קטגוריה"": ""אוזניות""}"
7910583238716,6773836808252,אוזניות גיימינג,₪420,₪440,ירושלים,https://cdn.shopify.com/s/files/1/0590/7860/6908/files/y2_0pa_010369_20250122210204_large.jpg?v=1737572570,https://market.yad2.co.il/collections/אלקטרוניקה_אביזרי-אלקטרוניקה_אוזניות/products/אוזניות-גיימינג-18,,2025-05-20,2025-05-25,,למכירה אוזניות גיימינג של חברת MARVO במצב חדש בקושי נעשה שימוש כל הקודם זוכה גמיש בקצת,"{""מצב המוצר"": ""כמו חדש"", ""יצרן"": ""MARVO"", ""תאימות"": ""גיימינג"", ""חיבורים"": ""חוטיות"", ""ישוב"": ""ירושלים"", ""קטגוריה"": ""אוזניות""}"
7911505625148,6924155912252,אוזניות B&W,"₪1,300","₪1,500",ירושלים,https://cdn.shopify.com/s/files/1/0590/7860/6908/files/y2_0pa_010962_20250421091959_large.jpg?v=1745216443,https://market.yad2.co.il/collections/אלקטרוניקה_אביזרי-אלקטרוניקה_אוזניות/products/אוזניות-b-w,,2025-05-20,2025-05-25,,"אוזניות חדשות של b&w המתמחים בסואנד ברמה מעל כולם עם חיבור בלוטוס 5.4 אצלי כיומיים שלש מצב חדש לגמרי רק קופסא פתוחה. עלות בחנויות כ-1,740₪ מוכר ב1300₪","{""מצב המוצר"": ""חדש באריזה"", ""יצרן"": ""B&W"", ""תאימות"": ""סלולר"", ""חיבורים"": ""Bluetooth - בלוטות'"", ""ישוב"": ""ירושלים"", ""קטגוריה"": ""אוזניות""}"
7912765784124,6937298862140,אוזניות,₪360,,קרית מוצקין,https://cdn.shopify.com/s/files/1/0590/7860/6908/files/y2_0pa_010258_20250126115145_large.jpg?v=1737885124,https://market.yad2.co.il/collections/אלקטרוניקה_אביזרי-אלקטרוניקה_אוזניות/products/אוזניות-547,,2025-05-20,2025-05-25,,"Life Q30
Noise Cancelling","{""מצב המוצר"": ""חדש באריזה"", ""יצרן"": ""Anker"", ""תאימות"": ""תקלוט ואולפן"", ""חיבורים"": ""Bluetooth - בלוטות'"", ""ישוב"": ""קרית מוצקין"", ""קטגוריה"": ""אוזניות""}"
7913083502652,6892182044732,Jabra Evolve2 65,₪590,₪690,תל אביב יפו,https://cdn.shopify.com/s/files/1/0590/7860/6908/files/y2_0pa_010772_20250127081742_large.jpg?v=1737958731,https://market.yad2.co.il/collections/אלקטרוניקה_אביזרי-אלקטרוניקה_אוזניות/products/jabra-evolve2-66,,2025-05-20,2025-05-25,,"אוזניות Jabra Evolve2 65
מתנה מהעבודה, נפתחו פעם אחת בלבד, לא שומשו כלל.
מצב כמו חדש, אלחוטיות עם סינון רעשים פאסיבי, 3 מיקרופונים, סוללה עד 37 שעות.
מתאימות ל-USB-C או Bluetooth בטווח של עד 30 מטר.
כולל: אוזניות, נרתיק נשיאה, רסיבר USB-C וכבל USB-C.","{""מצב המוצר"": ""חדש באריזה"", ""תאימות"": ""גיימינג"", ""חיבורים"": ""Bluetooth - בלוטות'"", ""יצרן"": ""Jabra - ג'ברה"", ""ישוב"": ""תל אביב יפו"", ""קטגוריה"": ""אוזניות""}"
7913160212540,6669679525948,אוזניות TWS אלחוטיות KUMI,₪200,₪250,תל אביב יפו,https://cdn.shopify.com/s/files/1/0590/7860/6908/files/y2_0pa_010803_20250410145032_large.jpg?v=1744285855,https://market.yad2.co.il/collections/אלקטרוניקה_אביזרי-אלקטרוניקה_אוזניות/products/אוזניות-tws-אלחוטיות-kumi,,2025-05-20,2025-05-25,,"קיבלתי את זה במתנה כשרכשתי מכשיר ואני חירש אין לי מה לעשות עם זה לכן מוכר
חדש לא נפתח בכלל
דגם:
Pods Mini Pro 2 לבן
לגבי מספר טל' בבקשה לשלוח הודעה ולא להתקשר כי אני חירש תודה","{""מצב המוצר"": ""חדש באריזה"", ""תאימות"": ""סלולר"", ""חיבורים"": ""Bluetooth - בלוטות'"", ""ישוב"": ""תל אביב יפו"", ""קטגוריה"": ""אוזניות""}"
7914154655804,6849884454972,אוזניות galaxy אלחוטי,₪300,₪380,אחיעזר,https://cdn.shopify.com/s/files/1/0590/7860/6908/files/y2_0pa_010484_20250428012232_large.jpg?v=1745792568,https://market.yad2.co.il/collections/אלקטרוניקה_אביזרי-אלקטרוניקה_אוזניות/products/אוזניות-galaxy-אלחוטי,,2025-05-20,2025-05-25,,אוזניות Samsung galaxy buds 3 חדשות באריזה במחיר משתלם כל הקודם זוכה!!!,"{""מצב המוצר"": ""חדש באריזה"", ""ישוב"": ""אחיעזר"", ""קטגוריה"": ""אוזניות""}"
7916086493244,6982869123132,Airpods 3 כחדשות באזור אילת,₪350,₪400,אילת,https://cdn.shopify.com/s/files/1/0590/7860/6908/files/y2_0pa_010295_20250407110757_large.jpg?v=1744013291,https://market.yad2.co.il/collections/אלקטרוניקה_אביזרי-אלקטרוניקה_אוזניות/products/airpods-3-עם-כיסוי-באילת,,2025-05-20,2025-05-25,,כחדשות עם האריזה המקורית וכיסוי סיליקון מהיום הראשון - באילת - גמיש במחיר,"{""מצב המוצר"": ""חדש באריזה"", ""תאימות"": ""סלולר"", ""חיבורים"": ""Bluetooth - בלוטות'"", ""יצרן"": ""Apple - אפל"", ""ישוב"": ""אילת"", ""קטגוריה"": ""אוזניות""}"
7916502941756,6975375573052,אוזניה נסתרת,₪300,₪350,עפולה,https://cdn.shopify.com/s/files/1/0590/7860/6908/files/y2_0pa_010711_20250131123011_large.jpg?v=1743853460,https://market.yad2.co.il/collections/אלקטרוניקה_אביזרי-אלקטרוניקה_אוזניות/products/אוזניה-נסתרת,,2025-05-20,2025-05-25,,"אוזניה נסתרת זעירה הנכנסת לתוך תעלת האוזן ואינה נראית מבחוץ. 
האוזניה מתחברת למכשיר טלפון סלולרי ומאפשרת ניהול שיחה רגילה. האוזניה פועלת עד 5 שעות ברציפות באמצעות 2 סוללות כפתור זעירות המסופקות בערכה. 


אוזניה באיכות שמע מצויינת!","{""מצב המוצר"": ""כמו חדש"", ""תאימות"": ""סלולר"", ""חיבורים"": ""Bluetooth - בלוטות'"", ""ישוב"": ""עפולה"", ""קטגוריה"": ""אוזניות""}"
7916596199484,6647520952380,למכירה Shokz openrun pro,₪400,₪450,קרית אתא,https://cdn.shopify.com/s/files/1/0590/7860/6908/files/y2_1pa_010403_20250413115639_large.jpg?v=1744534619,https://market.yad2.co.il/collections/אלקטרוניקה_אביזרי-אלקטרוניקה_אוזניות/products/למכירה-shokz-openrun-pro,,2025-05-20,2025-05-25,,"יש 2 אוזניות שחור וכחול אוזניות ספורט במצב פצצה 450 שח  AfterShokz OpenRun Pro נוחות האוזניות קטנות ב-20% מדגמים קודמים-מאפיין המסייע להתאמה טובה ונוחה יותר, תוך שמירה על עיצוב האוזן החשופה. תוכלו להגיע ליעדי האימונים שלכם ועם זאת להישאר מודעים לסביבה, להולכי רגל, רוכבי אופניים ועוד","{""מצב המוצר"": ""כמו חדש"", ""תאימות"": ""ספורט"", ""יצרן"": ""Shokz"", ""חיבורים"": ""Bluetooth - בלוטות'"", ""ישוב"": ""קרית אתא"", ""קטגוריה"": ""אוזניות""}"
7917517930556,6695151829052,אוזניות אלחוטיות Denon AH-GC30,"₪1,250","₪1,400",קדימה צורן,https://cdn.shopify.com/s/files/1/0590/7860/6908/files/y2_0pa_010835_20250510202902_large.jpg?v=1746898179,https://market.yad2.co.il/collections/אלקטרוניקה_אביזרי-אלקטרוניקה_אוזניות/products/אוזניות-אלחוטיות-denon-ah-gc30,,2025-05-20,2025-05-25,,"אוזניות פרמיום אלחוטיות עם ביטול רעשים
משלבות את טכנולוגיית ביטול הרעשים העדכנית ביותר כדי לספק חוויית שמע איכותית
קלות משקל מעל האוזן נוחות במיוחד ועמוסות בטכנולוגיות מתקדמות כדי לספק חוויית האזנה מדהימה מדי יום","{""מצב המוצר"": ""כמו חדש"", ""תאימות"": ""אוזניות פרימיום אלחוטיות עם ביטול רעשים"", ""יצרן"": ""Denon"", ""חיבורים"": ""Bluetooth - בלוטות'"", ""ישוב"": ""קדימה צורן"", ""קטגוריה"": ""אוזניות""}"
7917702152252,6911916146748,AirPods 3,₪300,,זכרון יעקב,https://cdn.shopify.com/s/files/1/0590/7860/6908/files/y2_0pa_010424_20250202225102_large.jpg?v=1738529487,https://market.yad2.co.il/collections/אלקטרוניקה_אביזרי-אלקטרוניקה_אוזניות/products/airpods-317,,2025-05-20,2025-05-25,,"Apple AirPods 3 
אוזניות מצוינות במצב טוב שמורות מאוד ונקיות מאוד. האוזניות מקוריות ומגיעות עם הקופסה שנרכשו איתה. איסוף מזכרון יעקוב/רמת גן","{""מצב המוצר"": ""כמו חדש"", ""תאימות"": ""סלולר"", ""ישוב"": ""זכרון יעקב"", ""קטגוריה"": ""אוזניות""}"
7918089830460,6666240491580,אוזניות בלוטות מסננות רעש,₪650,,ירושלים,https://cdn.shopify.com/s/files/1/0590/7860/6908/files/y2_0pa_010317_20250203130137_large.jpg?v=1738580604,https://market.yad2.co.il/collections/אלקטרוניקה_אביזרי-אלקטרוניקה_אוזניות/products/אוזניות-בלוטות-מסננות-רעש,,2025-05-20,2025-05-25,,"אוזניות בלוטות מסננות רעש מספר 1 בעולם שנועדו עבור שינה, במיוחד לאנשים שישנים על הצד! האוזניות מתאימות לשינה רציפה כל הלילה ולא מפעילות לחץ על האוזניים! בטריה שמספיקה ל14 שעות! עשרות רעשים לבנים ואפליקציה נוחה לניהול האוזניות. וכמובן איכות שמע מדהימה בלי קשר לשינה. האוזניות נקנו ב149$ דולר ושילמתי עוד 250 שח מיסים ומשלוח. למרות שיש כמה גדלים זה עדיין גדול לי ואני נאלצת להיפרד מהן בצער.","{""מצב המוצר"": ""חדש באריזה"", ""יצרן"": ""Anker"", ""תאימות"": ""סלולר"", ""חיבורים"": ""Bluetooth - בלוטות'"", ""ישוב"": ""ירושלים"", ""קטגוריה"": ""אוזניות""}"
7922644320316,6848680427580,HyperX Cloud Alpha S,₪300,₪500,חדרה,https://cdn.shopify.com/s/files/1/0590/7860/6908/files/y2_0pa_010981_20250502111418_large.jpg?v=1746173673,https://market.yad2.co.il/collections/אלקטרוניקה_אביזרי-אלקטרוניקה_אוזניות/products/hyperx-cloud-alpha-s,,2025-05-20,2025-05-25,,אוזניות גיימינג Cloud Alpha S של HyperX. אוזניות מעולות לגיימינג ולמוזיקה. מגיעות עם בקר שניתן לחבר אותן אליו ומכיל מיקסר של שני ערוצי שמע שונים (ניתן להגדיר אחד עבור אפליקציות צ'אט כמו דיסקורד ואת השני עבור המשחק ואז לאזן ביניהם על ידי המקשים בבקר). לחלופין ניתן גם לחבר אותן ישירות לחיבור השמע במכשיר. היו בשימוש שנה. שמורות היטב ונקיות.,"{""מצב המוצר"": ""כמו חדש"", ""יצרן"": ""HyperX"", ""תאימות"": ""גיימינג"", ""חיבורים"": ""חוטיות"", ""ישוב"": ""חדרה"", ""קטגוריה"": ""אוזניות""}"
